{
  "metadata": {
    "description": "Agent Plugins for Alibaba Cloud (Unofficial) equip AI coding agents with the skills to help you architect, deploy, and operate on Alibaba Cloud. This is a community-driven project and is NOT affiliated with Alibaba Cloud.",
    "version": "0.1.0"
  },
  "name": "agent-plugins-for-alicloud",
  "owner": {
    "name": "acloudlabs-unofficial"
  },
  "plugins": [
    {
      "category": "cli",
      "description": "Generate Alibaba Cloud CLI commands safely using MCP-based API discovery and command generation. No direct CLI execution — commands are generated for review only.",
      "keywords": [
        "alibabacloud",
        "aliyun",
        "cli",
        "command-generation",
        "api-discovery",
        "mcp"
      ],
      "name": "alibabacloud-cli-usage",
      "source": "./plugins/alibabacloud-cli-usage",
      "tags": [
        "alibabacloud",
        "cli",
        "command-generation"
      ],
      "version": "0.1.0"
    }
  ]
}